id,header,expanded,content
1,"JavaScript",true,"JavaScript (JS) is an interpreted computer programming language.It was originally implemented as part of web browsers so that client-side scripts could interact with the user, control the browser, communicate asynchronously, and alter the document content that was displayed.More recently, however, it has become common in both game development and the creation of desktop applications."
2,"Angular",,"Angular is a TypeScript-based, open-source framework developed by Google for building dynamic web applications. It provides a component-based architecture, two-way data binding, and dependency injection, making it suitable for large-scale, enterprise-level applications. Angular's CLI simplifies project creation, testing, and deployment, while its modular design ensures scalability and maintainability."
3,"React",,"React is a popular JavaScript library developed by Facebook for building user interfaces. It focuses on creating reusable components and efficiently managing UI updates with its virtual DOM. React's declarative syntax makes it easy to design interactive and responsive interfaces. It integrates seamlessly with state management libraries like Redux and MobX, and tools like Next.js enhance its capabilities for server-side rendering and static site generation."
4,"Vue.js",,"Vue.js is a progressive JavaScript framework known for its simplicity and flexibility. It is designed for building user interfaces and single-page applications. Vue offers a gentle learning curve, making it beginner-friendly while providing advanced features like state management (via Vuex) and routing (via Vue Router). Its reactive data-binding and component-based architecture ensure a smooth development experience."
5,"Blazor",,"Blazor is a .NET-based framework developed by Microsoft for building interactive web applications. It allows developers to use C# and Razor syntax to create web UIs, eliminating the need for JavaScript in many scenarios. Blazor supports both server-side and WebAssembly-based hosting models, enabling full-stack web development with .NET. Its seamless integration with existing .NET libraries and tooling makes it a powerful option for .NET developers."
